{
  "id": "vibe-coding-agentic-ai",
  "shortTitle": "Vibe Coding & Agentic AI",
  "audience": [
    "Einsteiger in Softwareentwicklung mit KI-Unterstützung",
    "Fachpersonen mit Produkt- oder Datenfokus"
  ],
  "outcome": "Teilnehmende bauen ein lauffaehiges, wartbares Produktinkrement.",
  "owners": ["team-learning"],
  "version": 1
}
